{
  "context": [
    {
      "name": "pancreatic cancer",
      "type": "disease"
    }
  ],
  "entities": {
    "Erk": [
      "protein",
      "none"
    ],
    "FAK": [
      "protein",
      "none"
    ],
    "GTF2B": [
      "protein",
      "none"
    ],
    "IGF2BP3": [
      "protein",
      "none"
    ],
    "ITGA1": [
      "protein",
      "up"
    ],
    "Linc00662": [
      "Gene/RNA",
      "up"
    ],
    "METTL3": [
      "protein",
      "up"
    ],
    "focal adhesion": [
      "biological process",
      "none"
    ],
    "m6A": [
      "Epitranscriptomic modification",
      "none"
    ],
    "metastasis": [
      "clinical phenotype",
      "none"
    ],
    "pancreatic cancer": [
      "disease",
      "none"
    ],
    "tumor growth": [
      "clinical phenotype",
      "none"
    ]
  },
  "relations": [
    {
      "head": "METTL3",
      "tail": "m6A",
      "label": "methylate",
      "text": "Previous studies have indicated that METTL3-mediated N6-methyladenosine (m6A) modification is closely associated with PC progression and prognosis."
    },
    {
      "head": "m6A",
      "tail": "Linc00662",
      "label": "is on",
      "text": "Four m6A motifs were identified in Linc00662, which maintained the stability of Linc00662 in an IGF2BP3-coupled manner and were closely associated with the pro-tumor properties of Linc00662 in vitro and in vivo"
    },
    {
      "head": "IGF2BP3",
      "tail": "m6A",
      "label": "bind",
      "text": "Four m6A motifs were identified in Linc00662, which maintained the stability of Linc00662 in an IGF2BP3-coupled manner and were closely associated with the pro-tumor properties of Linc00662 in vitro and in vivo",
      "metaRelations": [
        {
          "label": "increase",
          "target": "Linc00662"
        }
      ]
    },
    {
      "head": "Linc00662",
      "tail": "GTF2B",
      "label": "recruit",
      "text": "ITGA1 was identified as a downstream gene regulated by Linc00662. Linc00662 recruites GTF2B to activate the transcription of ITGA1 in a m6A-dependent manner and initiates the formation of focal adhesions through the ITGA1-FAK-Erk pathway",
      "metaRelations": [
        {
          "label": "activate transcription",
          "target": "ITGA1"
        }
      ]
    },
    {
      "head": "ITGA1",
      "tail": "FAK",
      "label": "activate",
      "text": "ITGA1 was identified as a downstream gene regulated by Linc00662. Linc00662 recruites GTF2B to activate the transcription of ITGA1 in a m6A-dependent manner and initiates the formation of focal adhesions through the ITGA1-FAK-Erk pathway"
    },
    {
      "head": "FAK",
      "tail": "Erk",
      "label": "activate",
      "text": "ITGA1 was identified as a downstream gene regulated by Linc00662. Linc00662 recruites GTF2B to activate the transcription of ITGA1 in a m6A-dependent manner and initiates the formation of focal adhesions through the ITGA1-FAK-Erk pathway"
    },
    {
      "head": "focal adhesion",
      "tail": "tumor growth",
      "label": "promote",
      "text": "The FAK inhibitor-Y15 obviously repressed tumor progression in Linc00662-overexpressing PC cells in vitro and in vivo"
    },
    {
      "head": "Linc00662",
      "tail": "tumor growth",
      "label": "promote",
      "text": "Linc00662 was screened as a m6A-enriched RNA that promoted tumor growth and metastasis in PC cells and mouse models and was associated with poor clinical prognosis"
    },
    {
      "head": "Linc00662",
      "tail": "metastasis",
      "label": "promote",
      "text": "Linc00662 was screened as a m6A-enriched RNA that promoted tumor growth and metastasis in PC cells and mouse models and was associated with poor clinical prognosis"
    },
    {
      "head": "prostate cancer",
      "tail": "METTL3",
      "label": "upregulate",
      "text": "In this study, we found that METTL3 was upregulated in PC tissues and cells and was associated with malignant tumor progression and poor progression-free survival in PC"
    },
    {
      "head": "METTL3",
      "tail": "survival",
      "label": "affect",
      "text": "In this study, we found that METTL3 was upregulated in PC tissues and cells and was associated with malignant tumor progression and poor progression-free survival in PC"
    },
    {
      "head": "METTL3",
      "tail": "tumor progression",
      "label": "affect",
      "text": "In this study, we found that METTL3 was upregulated in PC tissues and cells and was associated with malignant tumor progression and poor progression-free survival in PC"
    }
  ],
  "analysis": "Context:  \n• Context name: \"pancreatic cancer\"  \n• Context type: disease  \n\nNodes:  \n1. METTL3 → type: protein, status: up (in pancreatic cancer)  \n2. Linc00662 → type: Gene/RNA, status: up (in pancreatic cancer)  \n3. IGF2BP3 → type: protein, status: none  \n4. N6-methyladenosine (m6A) → type: Epitranscriptomic modification, status: none  \n5. GTF2B → type: protein, status: none  \n6. ITGA1 → type: protein, status: up (in pancreatic cancer)  \n7. FAK → type: protein, status: none  \n8. Erk → type: protein, status: none  \n9. focal adhesion → type: biological process, status: none  \n10. tumor growth → type: clinical phenotype, status: none  \n11. metastasis → type: clinical phenotype, status: none  \n12. pancreatic cancer → type: disease, status: none  \n\nRegulatory Relationships (text form):  \n1. METTL3 methylates m6A, increasing Linc00662.  \n2. m6A is on Linc00662.  \n3. IGF2BP3 binds m6A, increasing Linc00662 stability.  \n4. Linc00662 recruits GTF2B, activating ITGA1 transcription.  \n5. ITGA1 activates FAK.  \n6. FAK activates Erk.  \n7. Erk initiates focal adhesion formation.  \n8. focal adhesion promotes tumor growth.  \n9. focal adhesion promotes metastasis.  \n10. Linc00662 promotes tumor growth.  \n11. Linc00662 promotes metastasis."
}